{
    "positive_prompt": "a bottle with a rainbow galaxy inside it on top of a wooden table on a snowy mountain top with the ocean and clouds in the background with a shot glass beside containing darkness beside a snow sculpture in the shape of a fox",
    "negative_prompt": "blurry",
    "seed": 0,
    "steps": 4,
    "cfg": 1.2,
    "sampler_name": "euler",
    "scheduler": "sgm_uniform",
    "width": 1024,
    "height": 1024
}